{"ticker":"INTU","as_of":"2026-09-14","current_price":321.57,"implied_expectations":{"method":"10-year constant-growth FCFE proxy from FY2027 revenue midpoint, 10% discount rate, 16x terminal owner-cash multiple.","growth_required_by_owner_cash_margin":{"20%":0.0543,"21%":0.0478,"22%":0.0416,"23%":0.0356},"interpretation":"At normalized owner-cash margins of 20-23%, the reference price embeds only about 3.6-5.4% annual revenue/owner-cash growth over the explicit period, materially below FY2027 company revenue guidance of 9-10%. This is a model inference, not a market consensus forecast."},"scenarios":{"bear":{"fair_value_per_share":260.47,"upside_downside_pct":-19.0,"discount_rate":0.105,"terminal_owner_cash_multiple":14,"revenue_growth_path":[0.05,0.05,0.045,0.04,0.035,0.03,0.03,0.025,0.025,0.025],"owner_cash_margin_path":[0.19,0.1922,0.1944,0.1967,0.1989,0.2011,0.2033,0.2056,0.2078,0.21],"thesis":"AI/low-cost competition limits pricing power; TurboTax and Mailchimp remain weak; core GBS still grows but decelerates."},"base":{"fair_value_per_share":462.46,"upside_downside_pct":43.8,"discount_rate":0.095,"terminal_owner_cash_multiple":17,"revenue_growth_path":[0.09,0.085,0.08,0.07,0.065,0.06,0.055,0.05,0.045,0.04],"owner_cash_margin_path":[0.225,0.2278,0.2306,0.2333,0.2361,0.2389,0.2417,0.2444,0.2472,0.25],"thesis":"QuickBooks/IES, money and TurboTax Live sustain upper-single-digit long-run growth; restructuring and mix support owner-cash margin expansion."},"bull":{"fair_value_per_share":677.68,"upside_downside_pct":110.7,"discount_rate":0.09,"terminal_owner_cash_multiple":20,"revenue_growth_path":[0.115,0.11,0.1,0.09,0.085,0.08,0.07,0.06,0.055,0.05],"owner_cash_margin_path":[0.235,0.24,0.245,0.25,0.255,0.26,0.265,0.27,0.275,0.28],"thesis":"Intuit becomes the trusted system-of-intelligence layer for SMB/consumer finance, Enterprise Suite scales, AI increases cross-sell and assisted-tax economics."}},"permanent_loss_case":{"fair_value_per_share":136.17,"upside_downside_pct":-57.7,"discount_rate":0.115,"terminal_owner_cash_multiple":10,"description":"AI agents commoditize tax/bookkeeping interface, low-cost alternatives erode TurboTax, Mailchimp remains impaired, pricing power fades and normalized owner-cash margin falls toward mid-teens."},"expectation_gap_score":12,"asymmetry_score":7,"subjective_probabilities":null,"notes":"Scenario values are decision ranges, not point-price targets. FCFE proxy keeps SBC as a real compensation expense and does not add net debt separately."}